{
  "specversion": "1.0",
  "id": "wf-condition-evaluated-1",
  "source": "//workflow-service/execution-status",
  "type": "io.yoizen.workflow.condition.evaluated.v1",
  "resource": "tenant/tenant-a/workflow-execution/exec-1",
  "time": "2026-07-11T00:00:03.000Z",
  "traceid": "trace-wf-1",
  "causation_id": "wf-action-completed-1",
  "correlation_id": "corr-wf-1",
  "tenant": "tenant-a",
  "producer": "workflow-service",
  "domain": "workflow",
  "channel": "internal",
  "provider": "native",
  "accountid": "system",
  "idempotencykey": "idem-wf-condition-evaluated-1",
  "transport": { "method": "stream", "protocol": "internal", "depth": 4 },
  "data": {
    "received_at": "2026-07-11T00:00:03.000Z",
    "payload_inline": true,
    "payload_ref": null,
    "payload_bytes": 0,
    "payload_checksum": "chk",
    "payload": {
      "executionId": "exec-1",
      "actionIndex": 1,
      "expression": "{{results.fetch-customer.data.tier}}",
      "evaluatedValue": "320",
      "branchTaken": "100-500",
      "cases": ["0-100", "100-500", "500+"]
    }
  }
}
